{
  "$schema": "../../schemas/pinned-intro-carousel-v3.schema.json",
  "schemaVersion": 1,
  "id": "pinned-intro-carousel-v3",
  "platform": "instagram",
  "format": "carousel-3x4",
  "status": "approved-for-render",
  "publish": false,
  "canvas": { "width": 1080, "height": 1440 },
  "safeZone": { "top": 120, "right": 120, "bottom": 120, "left": 120 },
  "contentSource": {
    "path": "content/pinned-intro-carousel-v3.md",
    "sha256": "23d41e6978f2c55a2d31f5539a7d6ba3bf627488201235cc823e39126411650a",
    "freezeHeading": "# Exact copy freeze"
  },
  "captionSha256": "5bfd1c77b3f78b404715bc123d134504b408d61e0041d2b034fb769ae6c5d12b",
  "designTokens": {
    "ink": "#101010",
    "paper": "#f4f1e9",
    "blue": "#1546e8",
    "grid": "rgba(21, 70, 232, 0.105)"
  },
  "layoutFamily": "human-to-system-calm",
  "asset": {
    "id": "MAHTX_B6J9k",
    "name": "alexsmoley-photo-chair",
    "path": "assets/photos/alexsmoley-photo-chair.jpg",
    "sha256": "266a019b6d3758edc8d22216ad1a0b5acb6e1a57ae64f7c42475de3a17a187b8",
    "source": "Approved original portrait supplied by the author; 3:4 master at 1440x1920",
    "width": 1440,
    "height": 1920,
    "treatment": "single-use editorial portrait on slide 01; 3:4 composition preserved; no generative redraw"
  },
  "caption": [
    "Что ж, проверим, на что способны эти чёртовы железяки.",
    "Привет, я Саша Смолей. Работаю редактором в IT. Пишу тексты, проектирую интерфейсы, собираю сайты и понемногу вайбкожу.",
    "Писал для Kaspersky, Сбера, СИБУРа, NtechLab, Черкизово, Алюминиевой Ассоциации и других компаний. Ещё делаю агитматериалы для политических кампаний, в том числе для кандидатов в президенты.",
    "Сейчас проверяю, как использовать AI для производства контента. Не только генерировать текст, а выстроить процесс: найти тему, собрать фактуру, сделать текст и дизайн, проверить материал, опубликовать и разобрать результаты.",
    "Я проверяю этот процесс на собственном блоге. Здесь буду показывать, что сработало, где система ошиблась и что пришлось переделать руками."
  ],
  "slides": [
    {
      "id": "slide-01",
      "mode": "identity-cover",
      "headlineIndexes": [0],
      "text": ["Я Саша Смолей", "Редактор в IT"],
      "visualType": "photo",
      "usesApprovedPhoto": true,
      "expectedArrowCount": 0,
      "visualCoreCount": 1
    },
    {
      "id": "slide-02",
      "mode": "work-list",
      "headlineIndexes": [0],
      "text": ["Что я делаю", "Пишу тексты", "Проектирую интерфейсы", "Собираю сайты", "Понемногу вайбкожу"],
      "visualType": "typography",
      "usesApprovedPhoto": false,
      "expectedArrowCount": 0,
      "visualCoreCount": 1
    },
    {
      "id": "slide-03",
      "mode": "client-proof",
      "headlineIndexes": [0],
      "text": ["Для кого я писал", "Kaspersky", "Сбер", "СИБУР", "NtechLab", "Черкизово", "Алюминиевая Ассоциация", "Делаю агитматериалы для политических кампаний, в том числе для кандидатов в президенты"],
      "visualType": "evidence",
      "usesApprovedPhoto": false,
      "expectedArrowCount": 0,
      "visualCoreCount": 1
    },
    {
      "id": "slide-04",
      "mode": "current-task",
      "headlineIndexes": [0],
      "text": ["Сейчас проверяю, как использовать AI для производства контента", "Не только генерировать текст, а выстроить процесс от темы до готовой публикации"],
      "visualType": "system",
      "usesApprovedPhoto": false,
      "expectedArrowCount": 0,
      "visualCoreCount": 1
    },
    {
      "id": "slide-05",
      "mode": "process-map",
      "headlineIndexes": [0],
      "text": ["Весь путь материала", "тема", "фактура", "текст", "дизайн", "проверка", "публикация", "аналитика", "По каждому этапу фиксирую, что можно автоматизировать, а что нужно проверить самому"],
      "visualType": "process",
      "usesApprovedPhoto": false,
      "expectedArrowCount": 0,
      "visualCoreCount": 1
    },
    {
      "id": "slide-06",
      "mode": "author-control",
      "headlineIndexes": [0],
      "text": ["Что оставляю за собой", "выбор темы", "смысл", "финальная проверка", "Рутину хочу передать системе. Тему, смысл и финальный материал проверяю сам"],
      "visualType": "decision",
      "usesApprovedPhoto": false,
      "expectedArrowCount": 0,
      "visualCoreCount": 3
    },
    {
      "id": "slide-07",
      "mode": "blog-closing",
      "headlineIndexes": [0],
      "text": ["Что будет в блоге", "что сработало", "где система ошиблась", "что я переделал руками", "Подписывайтесь — буду показывать весь процесс на реальных материалах"],
      "visualType": "list",
      "usesApprovedPhoto": false,
      "expectedArrowCount": 0,
      "visualCoreCount": 1
    }
  ]
}
